{
  "$schema": "https://json-schema.org/draft/2020-12/schema",
  "$id": "https://schemas.pawnkit.dev/conformance-results/v1/schema.json",
  "title": "PawnKit conformance result report",
  "description": "Generic result format an implementation repository (pawn-parser, pawn-analysis, pawn-project, pawn-api, pawnserver, sampctl, or a third party) can emit to report what it satisfies against pawnkit-spec's RFCs/schemas/profiles. See conformance/manifest.md.",
  "type": "object",
  "required": ["schemaVersion", "subject", "generatedAt", "checks"],
  "properties": {
    "schemaVersion": { "type": "integer", "const": 1 },
    "subject": {
      "type": "object",
      "required": ["repository", "version"],
      "properties": {
        "repository": { "type": "string", "examples": ["pawn-parser", "sampctl"] },
        "version": { "type": "string", "description": "Version or commit of the subject repository under test." },
        "url": { "type": "string", "format": "uri" }
      },
      "additionalProperties": false
    },
    "generatedAt": { "type": "string", "format": "date-time" },
    "specVersion": {
      "type": "string",
      "description": "pawnkit-spec tag/commit these checks were run against.",
      "default": "main"
    },
    "profile": {
      "type": "string",
      "pattern": "^[a-z][a-z0-9-]*$",
      "description": "RFC 0001 profile id this run exercised, if the checks are profile-specific."
    },
    "checks": {
      "type": "array",
      "minItems": 1,
      "items": { "$ref": "#/$defs/check" }
    },
    "summary": {
      "type": "object",
      "properties": {
        "total": { "type": "integer", "minimum": 0 },
        "passed": { "type": "integer", "minimum": 0 },
        "failed": { "type": "integer", "minimum": 0 },
        "skipped": { "type": "integer", "minimum": 0 }
      },
      "additionalProperties": false
    }
  },
  "additionalProperties": false,
  "$defs": {
    "check": {
      "type": "object",
      "required": ["id", "rfc", "status"],
      "properties": {
        "id": {
          "type": "string",
          "description": "Stable id for this specific conformance assertion, e.g. \"pawn-project/dependency-string-format\".",
          "pattern": "^[a-z0-9][a-z0-9/_.-]*$"
        },
        "rfc": {
          "type": "string",
          "pattern": "^\\d{4}$",
          "description": "The rfcs/NNNN this check exercises, e.g. \"0002\"."
        },
        "schema": {
          "type": "string",
          "format": "uri",
          "description": "The schema $id this check validates against, if applicable."
        },
        "status": { "type": "string", "enum": ["pass", "fail", "skip"] },
        "message": { "type": "string" },
        "fixture": {
          "type": "string",
          "description": "Path or identifier of the input fixture exercised, for reproducibility."
        }
      },
      "additionalProperties": false
    }
  }
}
