{
  "schemaVersion": 1,
  "subject": {
    "repository": "pawn-project",
    "version": "v0.1.0",
    "url": "https://github.com/pawnkit/pawn-project"
  },
  "generatedAt": "2026-07-17T00:00:00Z",
  "specVersion": "main",
  "profile": "openmp",
  "checks": [
    {
      "id": "pawn-project/accepts-sampctl-manifest-unmodified",
      "rfc": "0002",
      "schema": "https://schemas.pawnkit.dev/pawn-project/v1/schema.json",
      "status": "pass",
      "fixture": "examples/pawn-project/valid.json"
    },
    {
      "id": "pawn-lock/round-trips-resolved-graph",
      "rfc": "0003",
      "schema": "https://schemas.pawnkit.dev/pawn-lock/v1/schema.json",
      "status": "pass",
      "fixture": "examples/pawn-lock/valid.json"
    },
    {
      "id": "pawn-project/rejects-unknown-profile-id",
      "rfc": "0001",
      "status": "skip",
      "message": "Profile rejection is not wired into this conformance run."
    }
  ],
  "summary": { "total": 3, "passed": 2, "failed": 0, "skipped": 1 }
}
